song,path_to_wav,artist,artist_genre,genre
i was made for lovin' you,./audio_data/metal_mp3/i was made for lovin' you.mp3,KISS,album rockglam rockhard rockmetalrock,metal
symphony of destruction,./audio_data/metal_mp3/symphony of destruction.mp3,Megadeth,album rockalternative metalhard rockmelodic thrashmetalold school thrashrockspeed metalthrash metal,metal
breaking the law,./audio_data/metal_mp3/breaking the law.mp3,Judas Priest,album rockbirmingham metalglam metalhard rockmetalpower metalrock,metal
we're not gonna take it,./audio_data/metal_mp3/we're not gonna take it.mp3,Twisted Sister,album rockglam metalhard rockmetalrock,metal
back in black,./audio_data/metal_mp3/back in black.mp3,AC/DC,australian rockhard rockrock,metal
cum on feel the noize,./audio_data/metal_mp3/cum on feel the noize.mp3,Quiet Riot,album rockclassic rockglam metalhard rockmetalrock,metal
panama - 2015 remaster,./audio_data/metal_mp3/panama - 2015 remaster.mp3,Van Halen,album rockclassic rockhard rockmetalrock,metal
i wanna rock,./audio_data/metal_mp3/i wanna rock.mp3,Twisted Sister,album rockglam metalhard rockmetalrock,metal
highway to hell,./audio_data/metal_mp3/highway to hell.mp3,AC/DC,australian rockhard rockrock,metal
hot for teacher - 2015 remaster,./audio_data/metal_mp3/hot for teacher - 2015 remaster.mp3,Van Halen,album rockclassic rockhard rockmetalrock,metal
i love it loud,./audio_data/metal_mp3/i love it loud.mp3,KISS,album rockglam rockhard rockmetalrock,metal
you shook me all night long,./audio_data/metal_mp3/you shook me all night long.mp3,AC/DC,australian rockhard rockrock,metal
jump - 2015 remaster,./audio_data/metal_mp3/jump - 2015 remaster.mp3,Van Halen,album rockclassic rockhard rockmetalrock,metal
t.n.t.,./audio_data/metal_mp3/t.n.t..mp3,AC/DC,australian rockhard rockrock,metal
eruption - 2015 remaster,./audio_data/metal_mp3/eruption - 2015 remaster.mp3,Van Halen,album rockclassic rockhard rockmetalrock,metal
thunderstruck,./audio_data/metal_mp3/thunderstruck.mp3,AC/DC,australian rockhard rockrock,metal
you've got another thing coming,./audio_data/metal_mp3/you've got another thing coming.mp3,Judas Priest,album rockbirmingham metalglam metalhard rockmetalpower metalrock,metal
heavy metal,./audio_data/metal_mp3/heavy metal.mp3,Sammy Hagar,album rockclassic rockcountry rockglam metalhard rockheartland rockmellow goldmetalrocksoft rock,metal
tornado of souls - remastered 2004,./audio_data/metal_mp3/tornado of souls - remastered 2004.mp3,Megadeth,album rockalternative metalhard rockmelodic thrashmetalold school thrashrockspeed metalthrash metal,metal
runnin' with the devil - 2015 remaster,./audio_data/metal_mp3/runnin' with the devil - 2015 remaster.mp3,Van Halen,album rockclassic rockhard rockmetalrock,metal
the kids are back,./audio_data/metal_mp3/the kids are back.mp3,Twisted Sister,album rockglam metalhard rockmetalrock,metal
mother,./audio_data/metal_mp3/mother.mp3,Danzig,alternative metalhard rockmetalnu metalrock,metal
children of the earth,./audio_data/metal_mp3/children of the earth.mp3,Praying Mantis,nwobhm,metal
angel witch,./audio_data/metal_mp3/angel witch.mp3,Angel Witch,doom metalmetalnwobhmnwothm,metal
race with the devil,./audio_data/metal_mp3/race with the devil.mp3,Girlschool,hard rockmetalnwobhm,metal
burn in hell,./audio_data/metal_mp3/burn in hell.mp3,Twisted Sister,album rockglam metalhard rockmetalrock,metal
cowboys from hell,./audio_data/metal_mp3/cowboys from hell.mp3,Pantera,alternative metalgroove metalhard rockmetalnu metalold school thrashrocktexas metal,metal
metal health (bang your head),./audio_data/metal_mp3/metal health (bang your head).mp3,Quiet Riot,album rockclassic rockglam metalhard rockmetalrock,metal
tomorrow's dream - 2021 remaster,./audio_data/metal_mp3/tomorrow's dream - 2021 remaster.mp3,Black Sabbath,album rockbirmingham metalclassic rockhard rockmetalrockstoner rockuk doom metal,metal
shot in the dark,./audio_data/metal_mp3/shot in the dark.mp3,Ozzy Osbourne,album rockbirmingham metalhard rockmetalrock,metal
living after midnight,./audio_data/metal_mp3/living after midnight.mp3,Judas Priest,album rockbirmingham metalglam metalhard rockmetalpower metalrock,metal
wasted,./audio_data/metal_mp3/wasted.mp3,Def Leppard,album rockglam metalhard rocknwobhmrock,metal
stargazer,./audio_data/metal_mp3/stargazer.mp3,Rainbow,album rockblues rockclassic rockglam metalhard rockmetalrock,metal
poison,./audio_data/metal_mp3/poison.mp3,Alice Cooper,album rockclassic rockdetroit rockglam metalglam rockhard rockmetalprotopunkrock,metal
no more tears,./audio_data/metal_mp3/no more tears.mp3,Ozzy Osbourne,album rockbirmingham metalhard rockmetalrock,metal
indians,./audio_data/metal_mp3/indians.mp3,Anthrax,album rockalternative metalhard rockmetalnu metalold school thrashrap metalrockspeed metalthrash metal,metal
lay it down,./audio_data/metal_mp3/lay it down.mp3,Ratt,album rockglam metalhard rockmetalrock,metal
the toxic waltz,./audio_data/metal_mp3/the toxic waltz.mp3,Exodus,death metalgroove metalhard rockmetalold school thrashspeed metalthrash metal,metal
seventeen,./audio_data/metal_mp3/seventeen.mp3,Winger,album rockglam metalhard rockrocksleaze rock,metal
caught in a mosh,./audio_data/metal_mp3/caught in a mosh.mp3,Anthrax,album rockalternative metalhard rockmetalnu metalold school thrashrap metalrockspeed metalthrash metal,metal
mexican radio,./audio_data/metal_mp3/mexican radio.mp3,Celtic Frost,black metalblack thrashdeath metaldeathrashdoom metalmetalold school thrashswiss black metalswiss metal,metal
swords and tequila,./audio_data/metal_mp3/swords and tequila.mp3,Riot,speed metalus power metal,metal
south of heaven,./audio_data/metal_mp3/south of heaven.mp3,Slayer,alternative metaldeath metalhard rockmetalnu metalold school thrashrockspeed metalthrash metal,metal
breaking the chains,./audio_data/metal_mp3/breaking the chains.mp3,Dokken,album rockglam metalhard rockmetalrock,metal
bringin' on the heartbreak,./audio_data/metal_mp3/bringin' on the heartbreak.mp3,Def Leppard,album rockglam metalhard rocknwobhmrock,metal
in my darkest hour - remastered,./audio_data/metal_mp3/in my darkest hour - remastered.mp3,Megadeth,album rockalternative metalhard rockmelodic thrashmetalold school thrashrockspeed metalthrash metal,metal
modern day cowboy,./audio_data/metal_mp3/modern day cowboy.mp3,Tesla,album rockclassic rockglam metalhard rockrocksacramento indie,metal
i surrender,./audio_data/metal_mp3/i surrender.mp3,Rainbow,album rockblues rockclassic rockglam metalhard rockmetalrock,metal
wheels of steel - 2009 remastered version,./audio_data/metal_mp3/wheels of steel - 2009 remastered version.mp3,Saxon,album rockglam metalhard rockmetalnwobhmpower metalrock,metal
walk,./audio_data/metal_mp3/walk.mp3,Pantera,alternative metalgroove metalhard rockmetalnu metalold school thrashrocktexas metal,metal
duality,./audio_data/metal_mp3/duality.mp3,Slipknot,alternative metalnu metalrap metal,metal
hail to the king,./audio_data/metal_mp3/hail to the king.mp3,Avenged Sevenfold,alternative metalnu metal,metal
cowboys from hell,./audio_data/metal_mp3/cowboys from hell.mp3,Pantera,alternative metalgroove metalhard rockmetalnu metalold school thrashrocktexas metal,metal
south of heaven,./audio_data/metal_mp3/south of heaven.mp3,Slayer,alternative metaldeath metalhard rockmetalnu metalold school thrashrockspeed metalthrash metal,metal
painkiller,./audio_data/metal_mp3/painkiller.mp3,Judas Priest,album rockbirmingham metalglam metalhard rockmetalpower metalrock,metal
my curse,./audio_data/metal_mp3/my curse.mp3,Killswitch Engage,alternative metalboston metalmelodic metalcoremetalcorenu metal,metal
davidian,./audio_data/metal_mp3/davidian.mp3,Machine Head,alternative metalgroove metalhard rockindustrial metalmelodic groove metalmelodic metalcoremetalnu metalprogressive groove metalrap rockrock,metal
freak on a leash,./audio_data/metal_mp3/freak on a leash.mp3,Korn,alternative metalfunk metalnu metalrap metalrock,metal
dragula,./audio_data/metal_mp3/dragula.mp3,Rob Zombie,alternative metalindustrial metalindustrial rocknu metalrap rockrock,metal
ace of spades,./audio_data/metal_mp3/ace of spades.mp3,Motörhead,album rockalternative metalhard rockmetalrockspeed metal,metal
symphony of destruction,./audio_data/metal_mp3/symphony of destruction.mp3,Megadeth,album rockalternative metalhard rockmelodic thrashmetalold school thrashrockspeed metalthrash metal,metal
down with the sickness,./audio_data/metal_mp3/down with the sickness.mp3,Disturbed,alternative metalnu metalrap metal,metal
hellraiser - 30th anniversary edition,./audio_data/metal_mp3/hellraiser - 30th anniversary edition.mp3,Ozzy Osbourne,album rockbirmingham metalhard rockmetalrock,metal
wait and bleed,./audio_data/metal_mp3/wait and bleed.mp3,Slipknot,alternative metalnu metalrap metal,metal
stinkfist,./audio_data/metal_mp3/stinkfist.mp3,TOOL,alternative metalalternative rockart rocknu metalprogressive metalprogressive rockrock,metal
your betrayal,./audio_data/metal_mp3/your betrayal.mp3,Bullet For My Valentine,alternative metalmelodic metalcoremetalcorenu metalrap rockuk metalcorewelsh metal,metal
die mf die,./audio_data/metal_mp3/die mf die.mp3,Dope,alternative metalindustrial metalindustrial rocknu metalrap rock,metal
sugar,./audio_data/metal_mp3/sugar.mp3,System Of A Down,alternative metalnu metalrap metalrock,metal
shadow moses,./audio_data/metal_mp3/shadow moses.mp3,Bring Me The Horizon,melodic metalcoremetalcorerockuk metalcore,metal
my own summer (shove it),./audio_data/metal_mp3/my own summer (shove it).mp3,Deftones,alternative metalnu metalrap metalrocksacramento indie,metal
blood and thunder,./audio_data/metal_mp3/blood and thunder.mp3,Mastodon,alternative metalatlanta metalhard rockmetalnu metalprogressive groove metalprogressive sludgerocksludge metalstoner metal,metal
roots bloody roots,./audio_data/metal_mp3/roots bloody roots.mp3,Sepultura,alternative metalbrazilian groove metalbrazilian metalbrazilian thrash metaldeath metaldeathrashgroove metalhard rocklatin metalmetalmetal mineironu metalold school thrashrockthrash metal,metal
you can't bring me down,./audio_data/metal_mp3/you can't bring me down.mp3,Suicidal Tendencies,alternative metalcalifornia hardcorecrossover thrashfunk metalhardcore punkmetalnu metalold school thrashpunkrap rockthrash metal,metal
are you dead yet?,./audio_data/metal_mp3/are you dead yet.mp3,Children Of Bodom,alternative metalfinnish death metalfinnish melodeathfinnish metalmelodic death metalmetalpower metal,metal
madhouse,./audio_data/metal_mp3/madhouse.mp3,Anthrax,album rockalternative metalhard rockmetalnu metalold school thrashrap metalrockspeed metalthrash metal,metal
"snap your fingers, snap your neck","./audio_data/metal_mp3/snap your fingers, snap your neck.mp3",Prong,alternative metalgroove metalhard rockindustrial metalmetalnu metalold school thrashrap rockthrash metal,metal
replica,./audio_data/metal_mp3/replica.mp3,Fear Factory,alternative metalgroove metalindustrial metalindustrial rockmetalnu metalrap metalrap rock,metal
war eternal,./audio_data/metal_mp3/war eternal.mp3,Arch Enemy,alternative metaldeath metalmelodic death metalmetalnu metalpower metalswedish death metalswedish melodeathswedish metal,metal
dying in your arms,./audio_data/metal_mp3/dying in your arms.mp3,Trivium,alternative metalmelodic metalcoremelodic thrashmetalmetalcorenu metal,metal
i wanna rock,./audio_data/metal_mp3/i wanna rock.mp3,Twisted Sister,album rockglam metalhard rockmetalrock,metal
stone the crow,./audio_data/metal_mp3/stone the crow.mp3,DOWN,alternative metalgroove metalhard rocklouisiana metalmetalnu metalrocksludge metalsouthern metalstoner metalsupergroup,metal
twilight of the thunder god,./audio_data/metal_mp3/twilight of the thunder god.mp3,Amon Amarth,alternative metaldeath metalmelodic death metalmetalpower metalswedish death metalswedish melodeathswedish metaltolkien metalviking metal,metal
carrion,./audio_data/metal_mp3/carrion.mp3,Parkway Drive,australian metalcoremelodic metalcoremetalcorenu metal,metal
l'enfant sauvage,./audio_data/metal_mp3/l'enfant sauvage.mp3,Gojira,alternative metalfrench death metalfrench metalmetalnu metalprogressive groove metalrock,metal
my girlfriend's girlfriend,./audio_data/metal_mp3/my girlfriend's girlfriend.mp3,Type O Negative,alternative metalgothic metalindustrial metalindustrial rockmetalnu metalrock,metal
heaven's a lie,./audio_data/metal_mp3/heaven's a lie.mp3,Lacuna Coil,alternative metalgothic metalgothic symphonic metalitalian gothicitalian gothic metalitalian metalslayersymphonic metal,metal
push it,./audio_data/metal_mp3/push it.mp3,Static-X,alternative metalgroove metalindustrial metalindustrial rocknu metalrap metalrap rock,metal
panic attack,./audio_data/metal_mp3/panic attack.mp3,Dream Theater,neo classical metalprogressive metal,metal
"deceiver, deceiver","./audio_data/metal_mp3/deceiver, deceiver.mp3",Arch Enemy,alternative metaldeath metalmelodic death metalmetalnu metalpower metalswedish death metalswedish melodeathswedish metal,metal
iou,./audio_data/metal_mp3/iou.mp3,Five Finger Death Punch,alternative metalgroove metalnu metal,metal
into the black,./audio_data/metal_mp3/into the black.mp3,Lords of Black,melodic metalsymphonic power metal,metal
breaking the law,./audio_data/metal_mp3/breaking the law.mp3,Judas Priest,album rockbirmingham metalglam metalhard rockmetalpower metalrock,metal
chøke øn the ashes øf yøur hate,./audio_data/metal_mp3/chøke øn the ashes øf yøur hate.mp3,Machine Head,alternative metalgroove metalhard rockindustrial metalmelodic groove metalmelodic metalcoremetalnu metalprogressive groove metalrap rockrock,metal
midnight sun,./audio_data/metal_mp3/midnight sun.mp3,Kreator,death metalgerman metalgerman thrash metalhard rockmelodic thrashmetalold school thrashpower metalspeed metalthrash metal,metal
am i evil?,./audio_data/metal_mp3/am i evil.mp3,Diamond Head,hard rockmetalnwobhmspeed metalthrash metal,metal
venerate me,./audio_data/metal_mp3/venerate me.mp3,HammerFall,gothenburg metalhard rockmelodic metalmetalneo classical metalpower metalswedish power metal,metal
chains of fury,./audio_data/metal_mp3/chains of fury.mp3,Manimal,melodic metalneo-trad metalpower metalsymphonic power metal,metal
slaughterhouse (feat. bryan garris of knocked loose),./audio_data/metal_mp3/slaughterhouse (feat. bryan garris of knocked loose).mp3,Motionless In White,alternative metalmetalcore,metal
separate ways,./audio_data/metal_mp3/separate ways.mp3,Eva Under Fire,pixieslayer,metal
övergivenheten - single edit,./audio_data/metal_mp3/övergivenheten - single edit.mp3,Soilwork,alternative metalmelodic death metalmelodic groove metalmelodic metalcoremetalmetalcorenu metalswedish death metalswedish melodeathswedish metal,metal
symphony of destruction,./audio_data/metal_mp3/symphony of destruction.mp3,Megadeth,album rockalternative metalhard rockmelodic thrashmetalold school thrashrockspeed metalthrash metal,metal
uranus (feat. michael starr),./audio_data/metal_mp3/uranus (feat. michael starr).mp3,NanowaR of Steel,comic metalitalian metalpower metal,metal
painkiller,./audio_data/metal_mp3/painkiller.mp3,Judas Priest,album rockbirmingham metalglam metalhard rockmetalpower metalrock,metal
it’s electric,./audio_data/metal_mp3/it’s electric.mp3,Diamond Head,hard rockmetalnwobhmspeed metalthrash metal,metal
who am i?,./audio_data/metal_mp3/who am i.mp3,DAMPF,,metal
holy wars...the punishment due - remastered,./audio_data/metal_mp3/holy wars...the punishment due - remastered.mp3,Megadeth,album rockalternative metalhard rockmelodic thrashmetalold school thrashrockspeed metalthrash metal,metal
hellfire thunderbolt,./audio_data/metal_mp3/hellfire thunderbolt.mp3,KK's Priest,metal,metal
beast of gévaudan,./audio_data/metal_mp3/beast of gévaudan.mp3,Powerwolf,german metalgerman power metalmetalpower metal,metal
walk,./audio_data/metal_mp3/walk.mp3,Pantera,alternative metalgroove metalhard rockmetalnu metalold school thrashrocktexas metal,metal
steel commanders,./audio_data/metal_mp3/steel commanders.mp3,Sabaton,metalpower metalswedish metalswedish power metal,metal
the circle of five,./audio_data/metal_mp3/the circle of five.mp3,Burning Witches,melodic metalslayerswiss metal,metal
hardcore,./audio_data/metal_mp3/hardcore.mp3,Beast In Black,finnish heavy metalfinnish power metalmelodic metalpower metal,metal
keeping me alive,./audio_data/metal_mp3/keeping me alive.mp3,Tygers Of Pan Tang,album rockhard rockmetalmodern hard rocknwobhm,metal
sainted by the storm,./audio_data/metal_mp3/sainted by the storm.mp3,Powerwolf,german metalgerman power metalmetalpower metal,metal
push,./audio_data/metal_mp3/push.mp3,Dio,album rockglam metalhard rockmetalpower metalrock,metal
from hell with love,./audio_data/metal_mp3/from hell with love.mp3,Beast In Black,finnish heavy metalfinnish power metalmelodic metalpower metal,metal
werewolves of armenia - rerecorded version,./audio_data/metal_mp3/werewolves of armenia - rerecorded version.mp3,Powerwolf,german metalgerman power metalmetalpower metal,metal
psycho thrilling,./audio_data/metal_mp3/psycho thrilling.mp3,Sister,sleaze rock,metal
the unkillable soldier,./audio_data/metal_mp3/the unkillable soldier.mp3,Sabaton,metalpower metalswedish metalswedish power metal,metal
don't look back,./audio_data/metal_mp3/don't look back.mp3,Mustasch,eurovisionstoner metalswedish alternative rock,metal
revolution is my name - 2020 terry date mix,./audio_data/metal_mp3/revolution is my name - 2020 terry date mix.mp3,Pantera,alternative metalgroove metalhard rockmetalnu metalold school thrashrocktexas metal,metal
the world is burning,./audio_data/metal_mp3/the world is burning.mp3,Ember Falls,electronic djentfinnish metalmelodic metal,metal
reaggression,./audio_data/metal_mp3/reaggression.mp3,Flotsam & Jetsam,metalold school thrashpower thrashspeed metalthrash metal,metal
into the storm,./audio_data/metal_mp3/into the storm.mp3,Gojira,alternative metalfrench death metalfrench metalmetalnu metalprogressive groove metalrock,metal
fever dreams,./audio_data/metal_mp3/fever dreams.mp3,Dio,album rockglam metalhard rockmetalpower metalrock,metal
immortally insane,./audio_data/metal_mp3/immortally insane.mp3,Pantera,alternative metalgroove metalhard rockmetalnu metalold school thrashrocktexas metal,metal
party in my head,./audio_data/metal_mp3/party in my head.mp3,Pain,industrial metalmetalneue deutsche hartepower metal,metal
dracula,./audio_data/metal_mp3/dracula.mp3,Mystic Prophecy,german metalgerman power metalmelodic metalmetalneo classical metalneo-trad metalpower metal,metal
i want out,./audio_data/metal_mp3/i want out.mp3,Helloween,german metalgerman power metalhard rockmelodic metalmetalneo classical metalold school thrashpower metalrockspeed metal,metal
jinnslammer,./audio_data/metal_mp3/jinnslammer.mp3,Ignea,gothic metalmelodic metalslayersymphonic death metalsymphonic metalsymphonic power metalukrainian metal,metal
masquerade of madness,./audio_data/metal_mp3/masquerade of madness.mp3,King Diamond,danish metaldeath metalhard rockmetalpower metalthrash metal,metal
we stand as one,./audio_data/metal_mp3/we stand as one.mp3,Burning Witches,melodic metalslayerswiss metal,metal
death by design,./audio_data/metal_mp3/death by design.mp3,Diamond Head,hard rockmetalnwobhmspeed metalthrash metal,metal
the skeleton key,./audio_data/metal_mp3/the skeleton key.mp3,Epica,dutch metalgothic metalgothic symphonic metalopera metalpower metalsymphonic metal,metal
sneeztem of a yawn,./audio_data/metal_mp3/sneeztem of a yawn.mp3,NanowaR of Steel,comic metalitalian metalpower metal,metal
life's a bitch,./audio_data/metal_mp3/life's a bitch.mp3,Accept,album rockgerman heavy metalgerman metalglam metalhard rockmetalpower metalrockspeed metalthrash metal,metal
feast of fire,./audio_data/metal_mp3/feast of fire.mp3,Trivium,alternative metalmelodic metalcoremelodic thrashmetalmetalcorenu metal,metal
construction of souls,./audio_data/metal_mp3/construction of souls.mp3,Avatar,alternative metalgothenburg metalmelodic death metalnu metalswedish melodeath,metal
strongest of the strong,./audio_data/metal_mp3/strongest of the strong.mp3,Kreator,death metalgerman metalgerman thrash metalhard rockmelodic thrashmetalold school thrashpower metalspeed metalthrash metal,metal
cyberhex,./audio_data/metal_mp3/cyberhex.mp3,Motionless In White,alternative metalmetalcore,metal
sorcerer's fate,./audio_data/metal_mp3/sorcerer's fate.mp3,Spirit Adrift,epic doom,metal
end of the attention span,./audio_data/metal_mp3/end of the attention span.mp3,Armored Saint,hard rockmetalthrash metalus power metal,metal
armed to the teeth,./audio_data/metal_mp3/armed to the teeth.mp3,Annihilator,canadian metaldeath metalhard rockmetalneo classical metalold school thrashpower metalspeed metaltechnical groove metalthrash metal,metal
a perfect day to die,./audio_data/metal_mp3/a perfect day to die.mp3,Onslaught,crossover thrashdeath metalmetalold school thrashspeed metalthrash metal,metal
at the end of the rainbow,./audio_data/metal_mp3/at the end of the rainbow.mp3,Enforcer,metalnew wave of speed metalnwothmspeed metalswedish heavy metalthrash metalvarmland rock,metal
return of the sentinel,./audio_data/metal_mp3/return of the sentinel.mp3,KK's Priest,metal,metal
masters of war,./audio_data/metal_mp3/masters of war.mp3,Amon Amarth,alternative metaldeath metalmelodic death metalmetalpower metalswedish death metalswedish melodeathswedish metaltolkien metalviking metal,metal
teardrinker,./audio_data/metal_mp3/teardrinker.mp3,Mastodon,alternative metalatlanta metalhard rockmetalnu metalprogressive groove metalprogressive sludgerocksludge metalstoner metal,metal
hellbreaker,./audio_data/metal_mp3/hellbreaker.mp3,Motorjesus,german hard rockmodern hard rock,metal
sermons of the sinner,./audio_data/metal_mp3/sermons of the sinner.mp3,KK's Priest,metal,metal
maximus,./audio_data/metal_mp3/maximus.mp3,Warkings,melodic metal,metal
the inevitable end,./audio_data/metal_mp3/the inevitable end.mp3,Manimal,melodic metalneo-trad metalpower metalsymphonic power metal,metal
we stand alone,./audio_data/metal_mp3/we stand alone.mp3,Angelus Apatrida,latin metalnew wave of thrash metalspanish metalthrash metal,metal
nabbed in nebraska,./audio_data/metal_mp3/nabbed in nebraska.mp3,Anvil,canadian metalhard rockmetalspeed metalthrash metal,metal
take the world,./audio_data/metal_mp3/take the world.mp3,Mammothor,,metal
warriors,./audio_data/metal_mp3/warriors.mp3,Warkings,melodic metal,metal
dragula,./audio_data/metal_mp3/dragula.mp3,Rob Zombie,alternative metalindustrial metalindustrial rocknu metalrap rockrock,metal
thunderstruck,./audio_data/metal_mp3/thunderstruck.mp3,AC/DC,australian rockhard rockrock,metal
you could be mine,./audio_data/metal_mp3/you could be mine.mp3,Guns N' Roses,glam metalhard rockrock,metal
them bones,./audio_data/metal_mp3/them bones.mp3,Alice In Chains,alternative metalalternative rockgrungehard rocknu metalrock,metal
cherry pie,./audio_data/metal_mp3/cherry pie.mp3,Warrant,album rockglam metalhard rockrock,metal
symphony of destruction,./audio_data/metal_mp3/symphony of destruction.mp3,Megadeth,album rockalternative metalhard rockmelodic thrashmetalold school thrashrockspeed metalthrash metal,metal
killing in the name,./audio_data/metal_mp3/killing in the name.mp3,Rage Against The Machine,alternative metalalternative rockconscious hip hopfunk metalnu metalpolitical hip hoprap metalrap rockrock,metal
we die young,./audio_data/metal_mp3/we die young.mp3,Alice In Chains,alternative metalalternative rockgrungehard rocknu metalrock,metal
living dead girl,./audio_data/metal_mp3/living dead girl.mp3,Rob Zombie,alternative metalindustrial metalindustrial rocknu metalrap rockrock,metal
holy wars...the punishment due - remastered,./audio_data/metal_mp3/holy wars...the punishment due - remastered.mp3,Megadeth,album rockalternative metalhard rockmelodic thrashmetalold school thrashrockspeed metalthrash metal,metal
painkiller,./audio_data/metal_mp3/painkiller.mp3,Judas Priest,album rockbirmingham metalglam metalhard rockmetalpower metalrock,metal
freak on a leash,./audio_data/metal_mp3/freak on a leash.mp3,Korn,alternative metalfunk metalnu metalrap metalrock,metal
tornado of souls,./audio_data/metal_mp3/tornado of souls.mp3,Megadeth,album rockalternative metalhard rockmelodic thrashmetalold school thrashrockspeed metalthrash metal,metal
my own summer (shove it),./audio_data/metal_mp3/my own summer (shove it).mp3,Deftones,alternative metalnu metalrap metalrocksacramento indie,metal
thunder kiss '65,./audio_data/metal_mp3/thunder kiss '65.mp3,White Zombie,alternative metalalternative rockhard rockindustrial metalmetalnu metalrap metalrap rockrock,metal
cowboys from hell,./audio_data/metal_mp3/cowboys from hell.mp3,Pantera,alternative metalgroove metalhard rockmetalnu metalold school thrashrocktexas metal,metal
bombtrack,./audio_data/metal_mp3/bombtrack.mp3,Rage Against The Machine,alternative metalalternative rockconscious hip hopfunk metalnu metalpolitical hip hoprap metalrap rockrock,metal
hammer smashed face,./audio_data/metal_mp3/hammer smashed face.mp3,Cannibal Corpse,alternative metalbrutal death metalbuffalo ny metaldeath metalmetal,metal
blind,./audio_data/metal_mp3/blind.mp3,Korn,alternative metalfunk metalnu metalrap metalrock,metal
be quiet and drive (far away),./audio_data/metal_mp3/be quiet and drive (far away).mp3,Deftones,alternative metalnu metalrap metalrocksacramento indie,metal
when worlds collide,./audio_data/metal_mp3/when worlds collide.mp3,Powerman 5000,alternative metalfunk metalindustrial metalindustrial rocknu metalrap metalrap rock,metal
black no. 1 (little miss scare -all),./audio_data/metal_mp3/black no. 1 (little miss scare -all).mp3,Type O Negative,alternative metalgothic metalindustrial metalindustrial rockmetalnu metalrock,metal
