song,path_to_wav,artist,artist_genre,genre
In the End,./audio_data/mp3_data/In the End.mp3,Linkin Park,alternative metalnu metalpost-grungerap metal,rock
Good Riddance (Time of Your Life),./audio_data/mp3_data/Good Riddance (Time of Your Life).mp3,Green Day,permanent wavepunk,rock
Basket Case,./audio_data/mp3_data/Basket Case.mp3,Green Day,permanent wavepunk,rock
Losing My Religion,./audio_data/mp3_data/Losing My Religion.mp3,R.E.M.,alternative rockathens indiepermanent wavepop rockrock,rock
Everlong,./audio_data/mp3_data/Everlong.mp3,Foo Fighters,alternative metalalternative rockmodern rockpermanent wavepost-grungerock,rock
Instant Crush (feat. Julian Casablancas),./audio_data/mp3_data/Instant Crush (feat. Julian Casablancas).mp3,Daft Punk,electrofilter house,rock
Bitter Sweet Symphony,./audio_data/mp3_data/Bitter Sweet Symphony.mp3,The Verve,alternative rockbritpoppermanent wavepop rockrockshoegaze,rock
R U Mine?,./audio_data/mp3_data/R U Mine.mp3,Arctic Monkeys,garage rockpermanent waverocksheffield indie,rock
Africa,./audio_data/mp3_data/Africa.mp3,TOTO,album rockclassic rockmellow goldrocksoft rockyacht rock,rock
Closer,./audio_data/mp3_data/Closer.mp3,The Chainsmokers,dance popedmelectropoppoppop dancetropical house,rock
Can't Stop,./audio_data/mp3_data/Can't Stop.mp3,Red Hot Chili Peppers,alternative rockfunk metalfunk rockpermanent wave,rock
Are You Gonna Be My Girl,./audio_data/mp3_data/Are You Gonna Be My Girl.mp3,Jet,alternative rockmodern rockrock,rock
My Sweet Lord - Remastered 2014,./audio_data/mp3_data/My Sweet Lord - Remastered 2014.mp3,George Harrison,album rockbeatlesqueclassic rockfolk rockmellow goldrocksoft rock,rock
Imagine - Remastered 2010,./audio_data/mp3_data/Imagine - Remastered 2010.mp3,John Lennon,album rockbeatlesqueclassic rockfolk rockmellow goldrock,rock
Do I Wanna Know?,./audio_data/mp3_data/Do I Wanna Know.mp3,Arctic Monkeys,garage rockpermanent waverocksheffield indie,rock
She Moves In Her Own Way,./audio_data/mp3_data/She Moves In Her Own Way.mp3,The Kooks,brighton indiemodern rockrock,rock
Naive,./audio_data/mp3_data/Naive.mp3,The Kooks,brighton indiemodern rockrock,rock
Numb,./audio_data/mp3_data/Numb.mp3,Linkin Park,alternative metalnu metalpost-grungerap metal,rock
Pumped Up Kicks,./audio_data/mp3_data/Pumped Up Kicks.mp3,Foster The People,indietronicamodern rockpop rockrock,rock
Clint Eastwood,./audio_data/mp3_data/Clint Eastwood.mp3,Gorillaz,alternative hip hop,rock
Pump Up The Jam - Edit,./audio_data/mp3_data/Pump Up The Jam - Edit.mp3,Technotronic,eurodanceeuropophip housenew beat,rock
Kiss from a Rose,./audio_data/mp3_data/Kiss from a Rose.mp3,Seal,british soulsoft rock,rock
Believe,./audio_data/mp3_data/Believe.mp3,Cher,dance pophollywoodnew wave pop,rock
Wannabe,./audio_data/mp3_data/Wannabe.mp3,Spice Girls,dance popeuropopgirl grouppop,rock
Back In Black,./audio_data/mp3_data/Back In Black.mp3,AC/DC,australian rockhard rockrock,rock
Should I Stay or Should I Go - Remastered,./audio_data/mp3_data/Should I Stay or Should I Go - Remastered.mp3,The Clash,classic rockpermanent wavepunkrock,rock
All Along the Watchtower,./audio_data/mp3_data/All Along the Watchtower.mp3,Jimi Hendrix,acid rockalbum rockblues rockclassic rockhard rockproto-metalpsychedelic rockrock,rock
Come Together - Remastered 2009,./audio_data/mp3_data/Come Together - Remastered 2009.mp3,The Beatles,beatlesquebritish invasionclassic rockmerseybeatpsychedelic rockrock,rock
Paradise City,./audio_data/mp3_data/Paradise City.mp3,Guns N' Roses,glam metalhard rockrock,rock
Fortunate Son,./audio_data/mp3_data/Fortunate Son.mp3,Creedence Clearwater Revival,album rockclassic rockcountry rockrocksouthern rockswamp rock,rock
Hotel California - 2013 Remaster,./audio_data/mp3_data/Hotel California - 2013 Remaster.mp3,Eagles,album rockclassic rockcountry rockfolk rockheartland rockmellow goldrocksoft rockyacht rock,rock
"Rocket Man (I Think It's Going To Be A Long, Long Time)","./audio_data/mp3_data/Rocket Man (I Think It's Going To Be A Long, Long Time).mp3",Elton John,glam rockmellow goldpiano rock,rock
Dream On,./audio_data/mp3_data/Dream On.mp3,Aerosmith,album rockclassic rockhard rockrock,rock
Highway to Hell,./audio_data/mp3_data/Highway to Hell.mp3,AC/DC,australian rockhard rockrock,rock
Immigrant Song - Remaster,./audio_data/mp3_data/Immigrant Song - Remaster.mp3,Led Zeppelin,album rockclassic rockhard rockrock,rock
Jump - 2015 Remaster,./audio_data/mp3_data/Jump - 2015 Remaster.mp3,Van Halen,album rockclassic rockhard rockmetalrock,rock
Don't Stop Believin',./audio_data/mp3_data/Don't Stop Believin'.mp3,Journey,album rockclassic rockhard rockmellow goldrocksoft rock,rock
Have You Ever Seen The Rain,./audio_data/mp3_data/Have You Ever Seen The Rain.mp3,Creedence Clearwater Revival,album rockclassic rockcountry rockrocksouthern rockswamp rock,rock
Sweet Child O' Mine,./audio_data/mp3_data/Sweet Child O' Mine.mp3,Guns N' Roses,glam metalhard rockrock,rock
Free Fallin',./audio_data/mp3_data/Free Fallin'.mp3,Tom Petty,album rockclassic rockcountry rockfolk rockheartland rockmellow goldpop rockrocksinger-songwritersoft rock,rock
(I Can't Get No) Satisfaction - Mono Version,./audio_data/mp3_data/(I Can't Get No) Satisfaction - Mono Version.mp3,The Rolling Stones,album rockbritish invasionclassic rockrock,rock
T.N.T.,./audio_data/mp3_data/T.N.T..mp3,AC/DC,australian rockhard rockrock,rock
You Shook Me All Night Long,./audio_data/mp3_data/You Shook Me All Night Long.mp3,AC/DC,australian rockhard rockrock,rock
Rebel Rebel - 2016 Remaster,./audio_data/mp3_data/Rebel Rebel - 2016 Remaster.mp3,David Bowie,art rockclassic rockglam rockpermanent waverock,rock
We Are The Champions - Remastered 2011,./audio_data/mp3_data/We Are The Champions - Remastered 2011.mp3,Queen,classic rockglam rockrock,rock
Saturday Night’s Alright (For Fighting) - Remastered 2014,./audio_data/mp3_data/Saturday Night’s Alright (For Fighting) - Remastered 2014.mp3,Elton John,glam rockmellow goldpiano rock,rock
Smoke On The Water - Remastered 2012,./audio_data/mp3_data/Smoke On The Water - Remastered 2012.mp3,Deep Purple,album rockblues rockclassic rockhard rockmetalpsychedelic rockrock,rock
Whole Lotta Love - 1990 Remaster,./audio_data/mp3_data/Whole Lotta Love - 1990 Remaster.mp3,Led Zeppelin,album rockclassic rockhard rockrock,rock
Sunshine Of Your Love,./audio_data/mp3_data/Sunshine Of Your Love.mp3,Cream,album rockart rockblues rockclassic rockfolk rockhard rockpsychedelic rockrockroots rocksupergroup,rock
I Saw Her Standing There - Remastered 2009,./audio_data/mp3_data/I Saw Her Standing There - Remastered 2009.mp3,The Beatles,beatlesquebritish invasionclassic rockmerseybeatpsychedelic rockrock,rock
Rock the Casbah - Remastered,./audio_data/mp3_data/Rock the Casbah - Remastered.mp3,The Clash,classic rockpermanent wavepunkrock,rock
Sweet Emotion,./audio_data/mp3_data/Sweet Emotion.mp3,Aerosmith,album rockclassic rockhard rockrock,rock
Another One Bites The Dust - Remastered 2011,./audio_data/mp3_data/Another One Bites The Dust - Remastered 2011.mp3,Queen,classic rockglam rockrock,rock
Edge of Seventeen - 2016 Remaster,./audio_data/mp3_data/Edge of Seventeen - 2016 Remaster.mp3,Stevie Nicks,album rockheartland rockmellow goldrocksoft rock,rock
Purple Haze,./audio_data/mp3_data/Purple Haze.mp3,Jimi Hendrix,acid rockalbum rockblues rockclassic rockhard rockproto-metalpsychedelic rockrock,rock
Werewolves of London - 2007 Remaster,./audio_data/mp3_data/Werewolves of London - 2007 Remaster.mp3,Warren Zevon,album rockclassic rockcountry rockfolkfolk rockheartland rockmellow goldpiano rockrockroots rocksinger-songwritersoft rock,rock
Layla,./audio_data/mp3_data/Layla.mp3,Derek & The Dominos,album rockart rockbluesblues rockbritish bluesclassic rockcountry rockelectric bluesfolk rockhard rockmellow goldpsychedelic rockrockroots rocksoft rock,rock
China Grove,./audio_data/mp3_data/China Grove.mp3,The Doobie Brothers,album rockart rockblues rockclassic rockcountry rockfolk rockhard rockheartland rockmellow goldrocksoft rockyacht rock,rock
"Paint It, Black","./audio_data/mp3_data/Paint It, Black.mp3",The Rolling Stones,album rockbritish invasionclassic rockrock,rock
You Really Got Me - 2015 Remaster,./audio_data/mp3_data/You Really Got Me - 2015 Remaster.mp3,Van Halen,album rockclassic rockhard rockmetalrock,rock
Bohemian Rhapsody - Remastered 2011,./audio_data/mp3_data/Bohemian Rhapsody - Remastered 2011.mp3,Queen,classic rockglam rockrock,rock
Old Time Rock & Roll,./audio_data/mp3_data/Old Time Rock & Roll.mp3,Bob Seger,album rockclassic rockcountry rockdetroit rockfolk rockhard rockheartland rockmellow goldrocksoft rock,rock
Livin' On A Prayer,./audio_data/mp3_data/Livin' On A Prayer.mp3,Bon Jovi,glam metalrock,rock
I Was Made For Lovin' You,./audio_data/mp3_data/I Was Made For Lovin' You.mp3,KISS,album rockclassic rockglam rockhard rockmetalrock,rock
Stuck In The Middle With You,./audio_data/mp3_data/Stuck In The Middle With You.mp3,Stealers Wheel,classic rockclassic uk popfolk rock,rock
Heart Of Glass - Special Mix,./audio_data/mp3_data/Heart Of Glass - Special Mix.mp3,Blondie,candy popnew wavenew wave poppermanent wavepower poprock,rock
Don't You (Forget About Me),./audio_data/mp3_data/Don't You (Forget About Me).mp3,Simple Minds,art rockdance rockmellow goldnew romanticnew wavenew wave poprockscottish new wavesoft rocksynthpop,rock
Hot for Teacher - 2015 Remaster,./audio_data/mp3_data/Hot for Teacher - 2015 Remaster.mp3,Van Halen,album rockclassic rockhard rockmetalrock,rock
My Life,./audio_data/mp3_data/My Life.mp3,Billy Joel,classic rockfolk rockmellow goldpiano rockrocksinger-songwritersoft rock,rock
Ziggy Stardust - 2012 Remaster,./audio_data/mp3_data/Ziggy Stardust - 2012 Remaster.mp3,David Bowie,art rockclassic rockglam rockpermanent waverock,rock
Lido Shuffle,./audio_data/mp3_data/Lido Shuffle.mp3,Boz Scaggs,adult standardsalbum rockart rockclassic rockclassic uk popcountry rockfolkfolk rockmellow goldsinger-songwritersoft rockyacht rock,rock
Life in the Fast Lane - 2013 Remaster,./audio_data/mp3_data/Life in the Fast Lane - 2013 Remaster.mp3,Eagles,album rockclassic rockcountry rockfolk rockheartland rockmellow goldrocksoft rockyacht rock,rock
All Day and All of the Night,./audio_data/mp3_data/All Day and All of the Night.mp3,The Kinks,album rockart rockbritish invasionclassic rockfolk rockglam rockmellow goldprotopunkpsychedelic rockrock,rock
Working for the Weekend,./audio_data/mp3_data/Working for the Weekend.mp3,Loverboy,album rockclassic canadian rockclassic rockglam metalhard rockheartland rockmellow goldnew wave poprocksoft rock,rock
Don't Stop Me Now - Remastered 2011,./audio_data/mp3_data/Don't Stop Me Now - Remastered 2011.mp3,Queen,classic rockglam rockrock,rock
The Man Who Sold The World,./audio_data/mp3_data/The Man Who Sold The World.mp3,Nirvana,grungepermanent waverock,rock
Hysteria - Remastered 2017,./audio_data/mp3_data/Hysteria - Remastered 2017.mp3,Def Leppard,album rockglam metalhard rocknwobhmrock,rock
No Rain,./audio_data/mp3_data/No Rain.mp3,Blind Melon,alternative metalalternative rockblues rockgrungepop rockrock,rock
You Make My Dreams (Come True),./audio_data/mp3_data/You Make My Dreams (Come True).mp3,Daryl Hall & John Oates,album rockclassic rockmellow goldrocksoft rockyacht rock,rock
Rosanna,./audio_data/mp3_data/Rosanna.mp3,TOTO,album rockclassic rockmellow goldrocksoft rockyacht rock,rock
Janie's Got A Gun,./audio_data/mp3_data/Janie's Got A Gun.mp3,Aerosmith,album rockclassic rockhard rockrock,rock
Don't Stop Believin',./audio_data/mp3_data/Don't Stop Believin'.mp3,Journey,album rockclassic rockhard rockmellow goldrocksoft rock,rock
Can't Fight This Feeling,./audio_data/mp3_data/Can't Fight This Feeling.mp3,REO Speedwagon,album rockclassic rockhard rockheartland rockmellow goldrocksoft rock,rock
All Things Must Pass - 2020 Mix,./audio_data/mp3_data/All Things Must Pass - 2020 Mix.mp3,George Harrison,album rockbeatlesqueclassic rockfolk rockmellow goldrocksoft rock,rock
Rich Girl,./audio_data/mp3_data/Rich Girl.mp3,Daryl Hall & John Oates,album rockclassic rockmellow goldrocksoft rockyacht rock,rock
November Rain,./audio_data/mp3_data/November Rain.mp3,Guns N' Roses,glam metalhard rockrock,rock
Eyes Without A Face - Remastered,./audio_data/mp3_data/Eyes Without A Face - Remastered.mp3,Billy Idol,album rockclassic rockdance rockhard rockmellow goldnew romanticnew wavenew wave poprocksoft rock,rock
Learn to Fly,./audio_data/mp3_data/Learn to Fly.mp3,Foo Fighters,alternative metalalternative rockmodern rockpermanent wavepost-grungerock,rock
All My Life,./audio_data/mp3_data/All My Life.mp3,Foo Fighters,alternative metalalternative rockmodern rockpermanent wavepost-grungerock,rock
Not Bad Luck,./audio_data/mp3_data/Not Bad Luck.mp3,Taylor Hawkins & The Coattail Riders,rock drums,rock
Best of You,./audio_data/mp3_data/Best of You.mp3,Foo Fighters,alternative metalalternative rockmodern rockpermanent wavepost-grungerock,rock
The Pretender,./audio_data/mp3_data/The Pretender.mp3,Foo Fighters,alternative metalalternative rockmodern rockpermanent wavepost-grungerock,rock
Way Down,./audio_data/mp3_data/Way Down.mp3,Taylor Hawkins & The Coattail Riders,rock drums,rock
Times Like These,./audio_data/mp3_data/Times Like These.mp3,Foo Fighters,alternative metalalternative rockmodern rockpermanent wavepost-grungerock,rock
Something from Nothing,./audio_data/mp3_data/Something from Nothing.mp3,Foo Fighters,alternative metalalternative rockmodern rockpermanent wavepost-grungerock,rock
Thanks for the Line,./audio_data/mp3_data/Thanks for the Line.mp3,The Birds of Satan,,rock
Walk,./audio_data/mp3_data/Walk.mp3,Foo Fighters,alternative metalalternative rockmodern rockpermanent wavepost-grungerock,rock
Crossed The Line,./audio_data/mp3_data/Crossed The Line.mp3,Taylor Hawkins & The Coattail Riders,rock drums,rock
Low,./audio_data/mp3_data/Low.mp3,Foo Fighters,alternative metalalternative rockmodern rockpermanent wavepost-grungerock,rock
Feed The Cruel,./audio_data/mp3_data/Feed The Cruel.mp3,NHC,,rock
Shame Shame,./audio_data/mp3_data/Shame Shame.mp3,Foo Fighters,alternative metalalternative rockmodern rockpermanent wavepost-grungerock,rock
Your Shoes,./audio_data/mp3_data/Your Shoes.mp3,Taylor Hawkins & The Coattail Riders,rock drums,rock
Cold Day In The Sun,./audio_data/mp3_data/Cold Day In The Sun.mp3,Foo Fighters,alternative metalalternative rockmodern rockpermanent wavepost-grungerock,rock
"The Man That Never Was - from ""Sound City"" - Original Soundtrack",./audio_data/mp3_data/The Man That Never Was - from Sound City - Original Soundtrack.mp3,Rick Springfield,album rockaustralian rockclassic rockheartland rockmellow goldnew wave poppop rocksoft rockyacht rock,rock
Aurora,./audio_data/mp3_data/Aurora.mp3,Foo Fighters,alternative metalalternative rockmodern rockpermanent wavepost-grungerock,rock
Middle Child,./audio_data/mp3_data/Middle Child.mp3,Taylor Hawkins & The Coattail Riders,rock drums,rock
These Days,./audio_data/mp3_data/These Days.mp3,Foo Fighters,alternative metalalternative rockmodern rockpermanent wavepost-grungerock,rock
You Can't Fix This,./audio_data/mp3_data/You Can't Fix This.mp3,Stevie Nicks,album rockheartland rockmellow goldrocksoft rock,rock
DOA,./audio_data/mp3_data/DOA.mp3,Foo Fighters,alternative metalalternative rockmodern rockpermanent wavepost-grungerock,rock
Pieces of the Puzzle,./audio_data/mp3_data/Pieces of the Puzzle.mp3,The Birds of Satan,,rock
Bob Quit His Job,./audio_data/mp3_data/Bob Quit His Job.mp3,Taylor Hawkins,rock drums,rock
Waiting On A War,./audio_data/mp3_data/Waiting On A War.mp3,Foo Fighters,alternative metalalternative rockmodern rockpermanent wavepost-grungerock,rock
The Ballad of the Birds of Satan,./audio_data/mp3_data/The Ballad of the Birds of Satan.mp3,The Birds of Satan,,rock
I Really Blew It,./audio_data/mp3_data/I Really Blew It.mp3,Taylor Hawkins & The Coattail Riders,rock drums,rock
Belly of an Insect,./audio_data/mp3_data/Belly of an Insect.mp3,Eric Avery,,rock
Welcome Home,./audio_data/mp3_data/Welcome Home.mp3,Coheed and Cambria,alternative metalemopop punkscreamo,rock
Range Rover Bitch,./audio_data/mp3_data/Range Rover Bitch.mp3,Taylor Hawkins,rock drums,rock
No Son Of Mine,./audio_data/mp3_data/No Son Of Mine.mp3,Foo Fighters,alternative metalalternative rockmodern rockpermanent wavepost-grungerock,rock
Have A Cigar,./audio_data/mp3_data/Have A Cigar.mp3,Foo Fighters,alternative metalalternative rockmodern rockpermanent wavepost-grungerock,rock
Rope,./audio_data/mp3_data/Rope.mp3,Foo Fighters,alternative metalalternative rockmodern rockpermanent wavepost-grungerock,rock
Devil That You Know,./audio_data/mp3_data/Devil That You Know.mp3,NHC,,rock
The Sky Is A Neighborhood,./audio_data/mp3_data/The Sky Is A Neighborhood.mp3,Foo Fighters,alternative metalalternative rockmodern rockpermanent wavepost-grungerock,rock
Overture,./audio_data/mp3_data/Overture.mp3,Dave Grohl,alternative rockrock drums,rock
Bridge Burning,./audio_data/mp3_data/Bridge Burning.mp3,Foo Fighters,alternative metalalternative rockmodern rockpermanent wavepost-grungerock,rock
I Could Be Somebody Else,./audio_data/mp3_data/I Could Be Somebody Else.mp3,NHC,,rock
Get The Money,./audio_data/mp3_data/Get The Money.mp3,Taylor Hawkins & The Coattail Riders,rock drums,rock
Turn Over The World,./audio_data/mp3_data/Turn Over The World.mp3,Perry Farrell,alternative rock,rock
Rudy,./audio_data/mp3_data/Rudy.mp3,Taylor Hawkins,rock drums,rock
Holding Poison,./audio_data/mp3_data/Holding Poison.mp3,Foo Fighters,alternative metalalternative rockmodern rockpermanent wavepost-grungerock,rock
You Should Be Dancing,./audio_data/mp3_data/You Should Be Dancing.mp3,Dee Gees,,rock
Run,./audio_data/mp3_data/Run.mp3,Foo Fighters,alternative metalalternative rockmodern rockpermanent wavepost-grungerock,rock
The Feast and The Famine,./audio_data/mp3_data/The Feast and The Famine.mp3,Foo Fighters,alternative metalalternative rockmodern rockpermanent wavepost-grungerock,rock
21st Century Fight Song,./audio_data/mp3_data/21st Century Fight Song.mp3,Jackson United,,rock
I'm Not That Girl,./audio_data/mp3_data/I'm Not That Girl.mp3,Kerry Ellis,west end,rock
Making A Fire,./audio_data/mp3_data/Making A Fire.mp3,Foo Fighters,alternative metalalternative rockmodern rockpermanent wavepost-grungerock,rock
Holy Man - Taylor Hawkins Version,./audio_data/mp3_data/Holy Man - Taylor Hawkins Version.mp3,Dennis Wilson,country rockfolk rockroots rock,rock
Your Wife is Calling,./audio_data/mp3_data/Your Wife is Calling.mp3,Lee Ving,,rock
Rock and Roll - Remaster,./audio_data/mp3_data/Rock and Roll - Remaster.mp3,Led Zeppelin,album rockclassic rockhard rockrock,rock
Smells Like Teen Spirit,./audio_data/mp3_data/Smells Like Teen Spirit.mp3,Nirvana,grungepermanent waverock,rock
Limelight,./audio_data/mp3_data/Limelight.mp3,Rush,album rockart rockcanadian metalclassic canadian rockclassic rockhard rockmetalprogressive rockrock,rock
She Sells Sanctuary,./audio_data/mp3_data/She Sells Sanctuary.mp3,The Cult,album rockalternative rockclassic rockglam metalhard rockmetalrock,rock
Sympathy For The Devil - 50th Anniversary Edition,./audio_data/mp3_data/Sympathy For The Devil - 50th Anniversary Edition.mp3,The Rolling Stones,album rockbritish invasionclassic rockrock,rock
You Shook Me All Night Long,./audio_data/mp3_data/You Shook Me All Night Long.mp3,AC/DC,australian rockhard rockrock,rock
Iron Man - 2012 - Remaster,./audio_data/mp3_data/Iron Man - 2012 - Remaster.mp3,Black Sabbath,album rockbirmingham metalclassic rockhard rockmetalrockstoner rockuk doom metal,rock
Everlong,./audio_data/mp3_data/Everlong.mp3,Foo Fighters,alternative metalalternative rockmodern rockpermanent wavepost-grungerock,rock
I Was Made For Lovin' You,./audio_data/mp3_data/I Was Made For Lovin' You.mp3,KISS,album rockclassic rockglam rockhard rockmetalrock,rock
Saturday Night’s Alright (For Fighting) - Remastered 2014,./audio_data/mp3_data/Saturday Night’s Alright (For Fighting) - Remastered 2014.mp3,Elton John,glam rockmellow goldpiano rock,rock
I Love Rock 'N Roll,./audio_data/mp3_data/I Love Rock 'N Roll.mp3,Joan Jett & The Blackhearts,glam punkrock,rock
One Way Or Another - Remastered,./audio_data/mp3_data/One Way Or Another - Remastered.mp3,Blondie,candy popnew wavenew wave poppermanent wavepower poprock,rock
Barracuda,./audio_data/mp3_data/Barracuda.mp3,Heart,album rockclassic rockhard rockheartland rockmellow goldnew wave poprocksoft rock,rock
Another One Bites The Dust - Remastered 2011,./audio_data/mp3_data/Another One Bites The Dust - Remastered 2011.mp3,Queen,classic rockglam rockrock,rock
Rock And Roll All Nite,./audio_data/mp3_data/Rock And Roll All Nite.mp3,KISS,album rockclassic rockglam rockhard rockmetalrock,rock
Should I Stay or Should I Go - Remastered,./audio_data/mp3_data/Should I Stay or Should I Go - Remastered.mp3,The Clash,classic rockpermanent wavepunkrock,rock
Dirty Deeds Done Dirt Cheap,./audio_data/mp3_data/Dirty Deeds Done Dirt Cheap.mp3,AC/DC,australian rockhard rockrock,rock
Edge of Seventeen - 2016 Remaster,./audio_data/mp3_data/Edge of Seventeen - 2016 Remaster.mp3,Stevie Nicks,album rockheartland rockmellow goldrocksoft rock,rock
I Want To Hold Your Hand - Remastered 2015,./audio_data/mp3_data/I Want To Hold Your Hand - Remastered 2015.mp3,The Beatles,beatlesquebritish invasionclassic rockmerseybeatpsychedelic rockrock,rock
I Hate Myself for Loving You,./audio_data/mp3_data/I Hate Myself for Loving You.mp3,Joan Jett & The Blackhearts,glam punkrock,rock
My Sharona,./audio_data/mp3_data/My Sharona.mp3,The Knack,album rockclassic rocknew wave poppower pop,rock
Immigrant Song - Remaster,./audio_data/mp3_data/Immigrant Song - Remaster.mp3,Led Zeppelin,album rockclassic rockhard rockrock,rock
My Generation - Mono Version,./audio_data/mp3_data/My Generation - Mono Version.mp3,The Who,album rockart rockblues rockbritish invasionclassic rockfolk rockhard rockmellow goldpsychedelic rockrock,rock
Song 2 - 2012 Remaster,./audio_data/mp3_data/Song 2 - 2012 Remaster.mp3,Blur,alternative rockbritpopmadchestermodern rockpermanent wavepop rockrock,rock
Rebel Yell,./audio_data/mp3_data/Rebel Yell.mp3,Billy Idol,album rockclassic rockdance rockhard rockmellow goldnew romanticnew wavenew wave poprocksoft rock,rock
We Got The Beat - 2011 Remaster,./audio_data/mp3_data/We Got The Beat - 2011 Remaster.mp3,The Go-Go's,album rockcandy popgirl groupjangle popmellow goldnew romanticnew wavenew wave poppermanent wavepop rockrocksoft rocksynthpop,rock
Back In Black,./audio_data/mp3_data/Back In Black.mp3,AC/DC,australian rockhard rockrock,rock
Come Together - Remastered 2009,./audio_data/mp3_data/Come Together - Remastered 2009.mp3,The Beatles,beatlesquebritish invasionclassic rockmerseybeatpsychedelic rockrock,rock
Last Nite,./audio_data/mp3_data/Last Nite.mp3,The Strokes,alternative rockgarage rockmodern rockpermanent waverock,rock
Sheena Is a Punk Rocker - 2017 Remaster,./audio_data/mp3_data/Sheena Is a Punk Rocker - 2017 Remaster.mp3,Ramones,classic rockearly us punkpermanent wavepunkrockskate punk,rock
Mississippi Queen,./audio_data/mp3_data/Mississippi Queen.mp3,Mountain,album rockblues rockclassic rockcountry rockhard rockproto-metalpsychedelic rock,rock
Sabotage,./audio_data/mp3_data/Sabotage.mp3,Beastie Boys,alternative rockeast coast hip hopgolden age hip hophip hopold school hip hopraprap rock,rock
I Wanna Rock,./audio_data/mp3_data/I Wanna Rock.mp3,Twisted Sister,album rockglam metalhard rockmetalrock,rock
(I Can't Get No) Satisfaction - Mono Version,./audio_data/mp3_data/(I Can't Get No) Satisfaction - Mono Version.mp3,The Rolling Stones,album rockbritish invasionclassic rockrock,rock
Black Dog - Remaster,./audio_data/mp3_data/Black Dog - Remaster.mp3,Led Zeppelin,album rockclassic rockhard rockrock,rock
No One Knows,./audio_data/mp3_data/No One Knows.mp3,Queens of the Stone Age,alternative metalalternative rockblues rockmodern rockpalm desert scenerockstoner metalstoner rock,rock
Come As You Are,./audio_data/mp3_data/Come As You Are.mp3,Nirvana,grungepermanent waverock,rock
Break on Through (To the Other Side),./audio_data/mp3_data/Break on Through (To the Other Side).mp3,The Doors,acid rockclassic rockpsychedelic rockrock,rock
School's Out,./audio_data/mp3_data/School's Out.mp3,Alice Cooper,album rockblues rockclassic rockdetroit rockglam metalglam rockhard rockmetalprotopunkrock,rock
Pour Some Sugar On Me - Remastered 2017,./audio_data/mp3_data/Pour Some Sugar On Me - Remastered 2017.mp3,Def Leppard,album rockglam metalhard rocknwobhmrock,rock
Highway to Hell,./audio_data/mp3_data/Highway to Hell.mp3,AC/DC,australian rockhard rockrock,rock
Heart-Shaped Box,./audio_data/mp3_data/Heart-Shaped Box.mp3,Nirvana,grungepermanent waverock,rock
"Paint It, Black - Mono","./audio_data/mp3_data/Paint It, Black - Mono.mp3",The Rolling Stones,album rockbritish invasionclassic rockrock,rock
Hit Me With Your Best Shot,./audio_data/mp3_data/Hit Me With Your Best Shot.mp3,Pat Benatar,album rockclassic rockmellow goldnew wave poprocksoft rock,rock
Seven Nation Army,./audio_data/mp3_data/Seven Nation Army.mp3,The White Stripes,alternative rockblues rockdetroit rockgarage rockmodern blues rockmodern rockpermanent wavepunk bluesrock,rock
White Wedding - Pt. 1,./audio_data/mp3_data/White Wedding - Pt. 1.mp3,Billy Idol,album rockclassic rockdance rockhard rockmellow goldnew romanticnew wavenew wave poprocksoft rock,rock
Basket Case,./audio_data/mp3_data/Basket Case.mp3,Green Day,permanent wavepunk,rock
Under Pressure - Remastered 2011,./audio_data/mp3_data/Under Pressure - Remastered 2011.mp3,Queen,classic rockglam rockrock,rock
What Is Life - Remastered 2014,./audio_data/mp3_data/What Is Life - Remastered 2014.mp3,George Harrison,album rockbeatlesqueclassic rockfolk rockmellow goldrocksoft rock,rock
